#;parent;type;ref;text
2459;2456;paragrafo;§ 3º;Os atuais parlamentares federais e estaduais eleitos Vice-Prefeitos, se convocados a exercer a função de Prefeito, não perderão o mandato parlamentar.
2460;2456;paragrafo;§ 4º;O número de Vereadores por Município será fixado, para a representação a ser eleita em 1988, pelo respectivo Tribunal Regional Eleitoral, respeitados os limites estipulados no art. 29, IV, da Constituição.
2461;2456;paragrafo;§ 5º;Para as eleições de 15 de novembro de 1988, ressalvados os que já exercem mandato eletivo, são inelegíveis para qualquer cargo, no território de jurisdição do titular, o cônjuge e os parentes por consangüinidade ou afinidade, até o segundo grau, ou por adoção, do Presidente da República, do Governador de Estado, do Governador do Distrito Federal e do Prefeito que tenham exercido mais da metade do mandato.
2462;2445;artigo;Art. 6º;Nos seis meses posteriores à promulgação da Constituição, parlamentares federais, reunidos em número não inferior a trinta, poderão requerer ao Tribunal Superior Eleitoral o registro de novo partido político, juntando ao requerimento o manifesto, o estatuto e o programa devidamente assinados pelos requerentes.
2463;2462;paragrafo;§ 1º;O registro provisório, que será concedido de plano pelo Tribunal Superior Eleitoral, nos termos deste artigo, defere ao novo partido todos os direitos, deveres e prerrogativas dos atuais, entre eles o de participar, sob legenda própria, das eleições que vierem a ser realizadas nos doze meses seguintes a sua formação.
2464;2462;paragrafo;§ 2º;O novo partido perderá automaticamente seu registro provisório se, no prazo de vinte e quatro meses, contados de sua formação, não obtiver registro definitivo no Tribunal Superior Eleitoral, na forma que a lei dispuser.
2465;2445;artigo;Art. 7º;O Brasil propugnará pela formação de um tribunal internacional dos direitos humanos.
2466;2445;artigo;Art. 8º;É concedida anistia aos que, no período de 18 de setembro de 1946 até a data da promulgação da Constituição, foram atingidos, em decorrência de motivação exclusivamente política, por atos de exceção, institucionais ou complementares, aos que foram abrangidos pelo Decreto Legislativo nº 18, de 15 de dezembro de 1961, e aos atingidos pelo Decreto-Lei nº 864, de 12 de setembro de 1969, asseguradas as promoções, na inatividade, ao cargo, emprego, posto ou graduação a que teriam direito se estivessem em serviço ativo, obedecidos os prazos de permanência em atividade previstos nas leis e regulamentos vigentes, respeitadas as características e peculiaridades das carreiras dos servidores públicos civis e militares e observados os respectivos regimes jurídicos.
2467;2466;paragrafo;§ 1º;O disposto neste artigo somente gerará efeitos financeiros a partir da promulgação da Constituição, vedada a remuneração de qualquer espécie em caráter retroativo.
2468;2466;paragrafo;§ 2º;Ficam assegurados os benefícios estabelecidos neste artigo aos trabalhadores do setor privado, dirigentes e representantes sindicais que, por motivos exclusivamente políticos, tenham sido punidos, demitidos ou compelidos ao afastamento das atividades remuneradas que exerciam, bem como aos que foram impedidos de exercer atividades profissionais em virtude de pressões ostensivas ou expedientes oficiais sigilosos.
2469;2466;paragrafo;§ 3º;Aos cidadãos que foram impedidos de exercer, na vida civil, atividade profissional específica, em decorrência das Portarias Reservadas do Ministério da Aeronáutica nº S-50-GM5, de 19 de junho de 1964, e nº S-285-GM5, será concedida reparação de natureza econômica, na forma que dispuser lei de iniciativa do Congresso Nacional e a entrar em vigor no prazo de doze meses a contar da promulgação da Constituição.
2470;2466;paragrafo;§ 4º;Aos que, por força de atos institucionais, tenham exercido gratuitamente mandato eletivo de Vereador serão computados, para efeito de aposentadoria no serviço público e previdência social, os respectivos períodos.
2471;2466;paragrafo;§ 5º;A anistia concedida nos termos deste artigo aplica-se aos servidores públicos civis e aos empregados em todos os níveis de governo ou em suas fundações, empresas públicas ou empresas mistas sob controle estatal, exceto nos Ministérios militares, que tenham sido punidos ou demitidos por atividades profissionais interrompidas em virtude de decisão de seus trabalhadores, bem como em decorrência do Decreto-Lei nº 1.632, de 4 de agosto de 1978, ou por motivos exclusivamente políticos, assegurada a readmissão dos que foram atingidos a partir de 1979, observado o disposto no § 1º.
2472;2445;artigo;Art. 9º;Os que, por motivos exclusivamente políticos, foram cassados ou tiveram seus direitos políticos suspensos no período de 15 de julho a 31 de dezembro de 1969, por ato do então Presidente da República, poderão requerer ao Supremo Tribunal Federal o reconhecimento dos direitos e vantagens interrompidos pelos atos punitivos, desde que comprovem terem sido estes eivados de vício grave.
2473;2472;paragrafo;Parágrafo único.;O Supremo Tribunal Federal proferirá a decisão no prazo de cento e vinte dias, a contar do pedido do interessado.
2474;2445;artigo;Art. 10.;Até que seja promulgada a lei complementar a que se refere o art. 7º, I, da Constituição:
2475;2474;inciso;I;"fica limitada a proteção nele referida ao aumento, para quatro vezes, da porcentagem prevista no art. 6º, caput e § 1º, da Lei nº 5.107, de 13 de setembro de 1966;"
2476;2474;inciso;II;fica vedada a dispensa arbitrária ou sem justa causa:
2477;2476;alinea;a;"do empregado eleito para cargo de direção de comissões internas de prevenção de acidentes, desde o registro de sua candidatura até um ano após o final de seu mandato;"
2478;2476;alinea;b;da empregada gestante, desde a confirmação da gravidez até cinco meses após o parto.
2479;2474;paragrafo;§ 1º;Até que a lei venha a disciplinar o disposto no art. 7º, XIX, da Constituição, o prazo da licença-paternidade a que se refere o inciso é de cinco dias.
2480;2474;paragrafo;§ 2º;Até ulterior disposição legal, a cobrança das contribuições para o custeio das atividades dos sindicatos rurais será feita juntamente com a do imposto territorial rural, pelo mesmo órgão arrecadador.
2481;2474;paragrafo;§ 3º;Na primeira comprovação do cumprimento das obrigações trabalhistas pelo empregador rural, na forma do art. 233, após a promulgação da Constituição, será certificada perante a Justiça do Trabalho a regularidade do contrato e das atualizações das obrigações trabalhistas de todo o período.
2482;2445;artigo;Art. 11.;Cada Assembléia Legislativa, com poderes constituintes, elaborará a Constituição do Estado, no prazo de um ano, contado da promulgação da Constituição Federal, obedecidos os princípios desta.
2483;2482;paragrafo;Parágrafo único.;Promulgada a Constituição do Estado, caberá à Câmara Municipal, no prazo de seis meses, votar a lei orgânica respectiva, em dois turnos de discussão e votação, respeitado o disposto na Constituição Federal e na Constituição estadual.
2484;2445;artigo;Art. 12.;Será criada, dentro de noventa dias da promulgação da Constituição, comissão de estudos territoriais, com dez membros indicados pelo Congresso Nacional e cinco pelo Poder Executivo, com a finalidade de apresentar estudos sobre o território nacional e anteprojetos relativos a novas unidades territoriais, notadamente na Amazônia Legal e em áreas pendentes de solução.
2485;2484;paragrafo;§ 1º;No prazo de um ano, a comissão submeterá ao Congresso Nacional os resultados de seus estudos para, nos termos da Constituição, serem apreciados nos doze meses subseqüentes, extinguindo-se logo após.
2486;2484;paragrafo;§ 2º;Os Estados e os Municípios deverão, no prazo de três anos, a contar da promulgação da Constituição, promover, mediante acordo ou arbitramento, a demarcação de suas linhas divisórias atualmente litigiosas, podendo para isso fazer alterações e compensações de área que atendam aos acidentes naturais, critérios históricos, conveniências administrativas e comodidade das populações limítrofes.
2487;2484;paragrafo;§ 3º;Havendo solicitação dos Estados e Municípios interessados, a União poderá encarregar-se dos trabalhos demarcatórios.
2488;2484;paragrafo;§ 4º;Se, decorrido o prazo de três anos, a contar da promulgação da Constituição, os trabalhos demarcatórios não tiverem sido concluídos, caberá à União determinar os limites das áreas litigiosas.
2489;2484;paragrafo;§ 5º;Ficam reconhecidos e homologados os atuais limites do Estado do Acre com os Estados do Amazonas e de Rondônia, conforme levantamentos cartográficos e geodésicos realizados pela comissão tripartite integrada por representantes dos Estados e dos serviços técnico-especializados do Instituto Brasileiro de Geografia e Estatística.
2490;2445;artigo;Art. 13.;É criado o Estado do Tocantins, pelo desmembramento da área descrita neste artigo, dando-se sua instalação no quadragésimo sexto dia após a eleição prevista no § 3º, mas não antes de 1º de janeiro de 1989.
2491;2490;paragrafo;§ 1º;O Estado do Tocantins integra a Região Norte e limita-se com o Estado de Goiás pelas divisas norte dos Municípios de São Miguel do Araguaia, Porangatu, Formoso, Minaçu, Cavalcante, Monte Alegre de Goiás e Campos Belos, conservando a leste, norte e oeste as divisas atuais de Goiás com os Estados da Bahia, Piauí, Maranhão, Pará e Mato Grosso.
2492;2490;paragrafo;§ 2º;O Poder Executivo designará uma das cidades do Estado para sua capital provisória até a aprovação da sede definitiva do governo pela Assembléia Constituinte.
2493;2490;paragrafo;§ 3º;O Governador, o Vice-Governador, os Senadores, os Deputados Federais e os Deputados Estaduais serão eleitos, em um único turno, até setenta e cinco dias após a promulgação da Constituição, mas não antes de 15 de novembro de 1988, a critério do Tribunal Superior Eleitoral, obedecidas, entre outras, as seguintes normas:
2494;2493;inciso;I;"o prazo de filiação partidária dos candidatos será encerrado setenta e cinco dias antes da data das eleições;"
2495;2493;inciso;II;"as datas das convenções regionais partidárias destinadas a deliberar sobre coligações e escolha de candidatos, de apresentação de requerimento de registro dos candidatos escolhidos e dos demais procedimentos legais serão fixadas, em calendário especial, pela Justiça Eleitoral;"
2496;2493;inciso;III;"são inelegíveis os ocupantes de cargos estaduais ou municipais que não se tenham deles afastado, em caráter definitivo, setenta e cinco dias antes da data das eleições previstas neste parágrafo;"
2497;2493;inciso;IV;ficam mantidos os atuais diretórios regionais dos partidos políticos do Estado de Goiás, cabendo às comissões executivas nacionais designar comissões provisórias no Estado do Tocantins, nos termos e para os fins previstos na lei.
2498;2490;paragrafo;§ 4º;"Os mandatos do Governador, do Vice-Governador, dos Deputados Federais e Estaduais eleitos na forma do parágrafo anterior extinguir-se-ão concomitantemente aos das demais unidades da Federação; o mandato do Senador eleito menos votado extinguir-se-á nessa mesma oportunidade, e os dos outros dois, juntamente com os dos Senadores eleitos em 1986 nos demais Estados."
2499;2490;paragrafo;§ 5º;A Assembléia Estadual Constituinte será instalada no quadragésimo sexto dia da eleição de seus integrantes, mas não antes de 1º de janeiro de 1989, sob a presidência do Presidente do Tribunal Regional Eleitoral do Estado de Goiás, e dará posse, na mesma data, ao Governador e ao Vice-Governador eleitos.
2500;2490;paragrafo;§ 6º;Aplicam-se à criação e instalação do Estado do Tocantins, no que couber, as normas legais disciplinadoras da divisão do Estado de Mato Grosso, observado o disposto no art. 234 da Constituição.
2501;2490;paragrafo;§ 7º;Fica o Estado de Goiás liberado dos débitos e encargos decorrentes de empreendimentos no território do novo Estado, e autorizada a União, a seu critério, a assumir os referidos débitos.
2502;2445;artigo;Art. 14.;Os Territórios Federais de Roraima e do Amapá são transformados em Estados Federados, mantidos seus atuais limites geográficos.
2503;2502;paragrafo;§ 1º;A instalação dos Estados dar-se-á com a posse dos Governadores eleitos em 1990.
2504;2502;paragrafo;§ 2º;Aplicam-se à transformação e instalação dos Estados de Roraima e Amapá as normas e os critérios seguidos na criação do Estado de Rondônia, respeitado o disposto na Constituição e neste Ato.
2505;2502;paragrafo;§ 3º;O Presidente da República, até quarenta e cinco dias após a promulgação da Constituição, encaminhará à apreciação do Senado Federal os nomes dos Governadores dos Estados de Roraima e do Amapá que exercerão o Poder Executivo até a instalação dos novos Estados com a posse dos Governadores eleitos.
2506;2502;paragrafo;§ 4º;Enquanto não concretizada a transformação em Estados, nos termos deste artigo, os Territórios Federais de Roraima e do Amapá serão beneficiados pela transferência de recursos prevista nos arts. 159, I, a , da Constituição, e 34, § 2º, II, deste Ato.
2507;2445;artigo;Art. 15.;Fica extinto o Território Federal de Fernando de Noronha, sendo sua área reincorporada ao Estado de Pernambuco.
2508;2445;artigo;Art. 16.;Até que se efetive o disposto no art. 32, § 2º, da Constituição, caberá ao Presidente da República, com a aprovação do Senado Federal, indicar o Governador e o Vice-Governador do Distrito Federal.
2509;2508;paragrafo;§ 1º;A competência da Câmara Legislativa do Distrito Federal, até que se instale, será exercida pelo Senado Federal.
2510;2508;paragrafo;§ 2º;A fiscalização contábil, financeira, orçamentária, operacional e patrimonial do Distrito Federal, enquanto não for instalada a Câmara Legislativa, será exercida pelo Senado Federal, mediante controle externo, com o auxílio do Tribunal de Contas do Distrito Federal, observado o disposto no art. 72 da Constituição.
2511;2508;paragrafo;§ 3º;Incluem-se entre os bens do Distrito Federal aqueles que lhe vierem a ser atribuídos pela União na forma da lei.
2512;2445;artigo;Art. 17.;Os vencimentos, a remuneração, as vantagens e os adicionais, bem como os proventos de aposentadoria que estejam sendo percebidos em desacordo com a Constituição serão imediatamente reduzidos aos limites dela decorrentes, não se admitindo, neste caso, invocação de direito adquirido ou percepção de excesso a qualquer título.
2513;2512;paragrafo;§ 1º;É assegurado o exercício cumulativo de dois cargos ou empregos privativos de médico que estejam sendo exercidos por médico militar na administração pública direta ou indireta.
2514;2512;paragrafo;§ 2º;É assegurado o exercício cumulativo de dois cargos ou empregos privativos de profissionais de saúde que estejam sendo exercidos na administração pública direta ou indireta.
2515;2445;artigo;Art. 18.;Ficam extintos os efeitos jurídicos de qualquer ato legislativo ou administrativo, lavrado a partir da instalação da Assembléia Nacional Constituinte, que tenha por objeto a concessão de estabilidade a servidor admitido sem concurso público, da administração direta ou indireta, inclusive das fundações instituídas e mantidas pelo Poder Público.
2516;2445;artigo;Art. 19.;Os servidores públicos civis da União, dos Estados, do Distrito Federal e dos Municípios, da administração direta, autárquica e das fundações públicas, em exercício na data da promulgação da Constituição, há pelo menos cinco anos continuados, e que não tenham sido admitidos na forma regulada no art. 37 da Constituição, são considerados estáveis no serviço público.
2517;2516;paragrafo;§ 1º;O tempo de serviço dos servidores referidos neste artigo será contado como título quando se submeterem a concurso para fins de efetivação, na forma da lei.
2518;2516;paragrafo;§ 2º;O disposto neste artigo não se aplica aos ocupantes de cargos, funções e empregos de confiança ou em comissão, nem aos que a lei declare de livre exoneração, cujo tempo de serviço não será computado para os fins do caput deste artigo, exceto se se tratar de servidor.
2519;2516;paragrafo;§ 3º;O disposto neste artigo não se aplica aos professores de nível superior, nos termos da lei.
2520;2445;artigo;Art. 20.;Dentro de cento e oitenta dias, proceder-se-á à revisão dos direitos dos servidores públicos inativos e pensionistas e à atualização dos proventos e pensões a eles devidos, a fim de ajustá-los ao disposto na Constituição.
2521;2445;artigo;Art. 21.;Os juízes togados de investidura limitada no tempo, admitidos mediante concurso público de provas e títulos e que estejam em exercício na data da promulgação da Constituição, adquirem estabilidade, observado o estágio probatório, e passam a compor quadro em extinção, mantidas as competências, prerrogativas e restrições da legislação a que se achavam submetidos, salvo as inerentes à transitoriedade da investidura.
2522;2521;paragrafo;Parágrafo único.;A aposentadoria dos juízes de que trata este artigo regular-se-á pelas normas fixadas para os demais juízes estaduais.
2523;2445;artigo;Art. 22.;É assegurado aos defensores públicos investidos na função até a data de instalação da Assembléia Nacional Constituinte o direito de opção pela carreira, com a observância das garantias e vedações previstas no art. 134, parágrafo único, da Constituição.
2524;2445;artigo;Art. 23.;Até que se edite a regulamentação do art. 21, XVI, da Constituição, os atuais ocupantes do cargo de censor federal continuarão exercendo funções com este compatíveis, no Departamento de Polícia Federal, observadas as disposições constitucionais.
2525;2524;paragrafo;Parágrafo único.;A lei referida disporá sobre o aproveitamento dos censores federais, nos termos deste artigo.
2526;2445;artigo;Art. 24.;A União, os Estados, o Distrito Federal e os Municípios editarão leis que estabeleçam critérios para a compatibilização de seus quadros de pessoal ao disposto no art. 39 da Constituição e à reforma administrativa dela decorrente, no prazo de dezoito meses, contados da sua promulgação.
2527;2445;artigo;Art. 25.;Ficam revogados, a partir de cento e oitenta dias da promulgação da Constituição, sujeito este prazo a prorrogação por lei, todos os dispositivos legais que atribuam ou deleguem a órgão do Poder Executivo competência assinalada pela Constituição ao Congresso Nacional, especialmente no que tange a:
2528;2527;inciso;I;"ação normativa;"
2529;2527;inciso;II;alocação ou transferência de recursos de qualquer espécie.
2530;2527;paragrafo;§ 1º;Os decretos-leis em tramitação no Congresso Nacional e por este não apreciados até a promulgação da Constituição terão seus efeitos regulados da seguinte forma:
2531;2530;inciso;I;"se editados até 2 de setembro de 1988, serão apreciados pelo Congresso Nacional no prazo de até cento e oitenta dias a contar da promulgação da Constituição, não computado o recesso parlamentar;"
2532;2530;inciso;II;"decorrido o prazo definido no inciso anterior, e não havendo apreciação, os decretos-leis ali mencionados serão considerados rejeitados;"
2533;2530;inciso;III;nas hipóteses definidas nos incisos I e II, terão plena validade os atos praticados na vigência dos respectivos decretos-leis, podendo o Congresso Nacional, se necessário, legislar sobre os efeitos deles remanescentes.
2534;2527;paragrafo;§ 2º;Os decretos-leis editados entre 3 de setembro de 1988 e a promulgação da Constituição serão convertidos, nesta data, em medidas provisórias, aplicando-se-lhes as regras estabelecidas no art. 62, parágrafo único.
2535;2445;artigo;Art. 26.;No prazo de um ano a contar da promulgação da Constituição, o Congresso Nacional promoverá, através de comissão mista, exame analítico e pericial dos atos e fatos geradores do endividamento externo brasileiro.
2536;2535;paragrafo;§ 1º;A comissão terá a força legal de comissão parlamentar de inquérito para os fins de requisição e convocação, e atuará com o auxílio do Tribunal de Contas da União.
2537;2535;paragrafo;§ 2º;Apurada irregularidade, o Congresso Nacional proporá ao Poder Executivo a declaração de nulidade do ato e encaminhará o processo ao Ministério Público Federal, que formalizará, no prazo de sessenta dias, a ação cabível.
2538;2445;artigo;Art. 27.;O Superior Tribunal de Justiça será instalado sob a presidência do Supremo Tribunal Federal.
2539;2538;paragrafo;§ 1º;Até que se instale o Superior Tribunal de Justiça, o Supremo Tribunal Federal exercerá as atribuições e competências definidas na ordem constitucional precedente.
2540;2538;paragrafo;§ 2º;A composição inicial do Superior Tribunal de Justiça far-se-á:
2541;2540;inciso;I;"pelo aproveitamento dos Ministros do Tribunal Federal de Recursos;"
2542;2540;inciso;II;pela nomeação dos Ministros que sejam necessários para completar o número estabelecido na Constituição.
2543;2538;paragrafo;§ 3º;Para os efeitos do disposto na Constituição, os atuais Ministros do Tribunal Federal de Recursos serão considerados pertencentes à classe de que provieram, quando de sua nomeação.
2544;2538;paragrafo;§ 4º;Instalado o Tribunal, os Ministros aposentados do Tribunal Federal de Recursos tornar-se-ão, automaticamente, Ministros aposentados do Superior Tribunal de Justiça.
2545;2538;paragrafo;§ 5º;Os Ministros a que se refere o § 2º, II, serão indicados em lista tríplice pelo Tribunal Federal de Recursos, observado o disposto no art. 104, parágrafo único, da Constituição.
2546;2538;paragrafo;§ 6º;Ficam criados cinco Tribunais Regionais Federais, a serem instalados no prazo de seis meses a contar da promulgação da Constituição, com a jurisdição e sede que lhes fixar o Tribunal Federal de Recursos, tendo em conta o número de processos e sua localização geográfica.
2547;2538;paragrafo;§ 7º;Até que se instalem os Tribunais Regionais Federais, o Tribunal Federal de Recursos exercerá a competência a eles atribuída em todo o território nacional, cabendo-lhe promover sua instalação e indicar os candidatos a todos os cargos da composição inicial, mediante lista tríplice, podendo desta constar juízes federais de qualquer região, observado o disposto no § 9º.
2548;2538;paragrafo;§ 8º;É vedado, a partir da promulgação da Constituição, o provimento de vagas de Ministros do Tribunal Federal de Recursos.
2549;2538;paragrafo;§ 9º;Quando não houver juiz federal que conte o tempo mínimo previsto no art. 107, II, da Constituição, a promoção poderá contemplar juiz com menos de cinco anos no exercício do cargo.
2550;2538;paragrafo;§ 10.;Compete à Justiça Federal julgar as ações nela propostas até a data da promulgação da Constituição, e aos Tribunais Regionais Federais, bem como ao Superior Tribunal de Justiça, julgar as ações rescisórias das decisões até então proferidas pela Justiça Federal, inclusive daquelas cuja matéria tenha passado à competência de outro ramo do Judiciário.
2551;2538;paragrafo;§ 11.;"São criados, ainda, os seguintes Tribunais Regionais Federais: o da 6ª Região, com sede em Curitiba, Estado do Paraná, e jurisdição nos Estados do Paraná, Santa Catarina e Mato Grosso do Sul; o da 7ª Região, com sede em Belo Horizonte, Estado de Minas Gerais, e jurisdição no Estado de Minas Gerais; o da 8ª Região, com sede em Salvador, Estado da Bahia, e jurisdição nos Estados da Bahia e Sergipe; e o da 9ª Região, com sede em Manaus, Estado do Amazonas, e jurisdição nos Estados do Amazonas, Acre, Rondônia e Roraima."
2552;2445;artigo;Art. 28.;"Os juízes federais de que trata o art. 123, § 2º, da Constituição de 1967, com a redação dada pela Emenda Constitucional nº 7, de 1977, ficam investidos na titularidade de varas na seção judiciária para a qual tenham sido nomeados ou designados; na inexistência de vagas, proceder-se-á ao desdobramento das varas existentes."
2553;2552;paragrafo;Parágrafo único.;Para efeito de promoção por antiguidade, o tempo de serviço desses juízes será computado a partir do dia de sua posse.
2554;2445;artigo;Art. 29.;Enquanto não aprovadas as leis complementares relativas ao Ministério Público e à Advocacia-Geral da União, o Ministério Público Federal, a Procuradoria-Geral da Fazenda Nacional, as Consultorias Jurídicas dos Ministérios, as Procuradorias e Departamentos Jurídicos de autarquias federais com representação própria e os membros das Procuradorias das universidades fundacionais públicas continuarão a exercer suas atividades na área das respectivas atribuições.
2555;2554;paragrafo;§ 1º;O Presidente da República, no prazo de cento e vinte dias, encaminhará ao Congresso Nacional projeto de lei complementar dispondo sobre a organização e o funcionamento da Advocacia-Geral da União.
2556;2554;paragrafo;§ 2º;Aos atuais Procuradores da República, nos termos da lei complementar, será facultada a opção, de forma irretratável, entre as carreiras do Ministério Público Federal e da Advocacia-Geral da União.
