#;parent;type;ref;text
847;842;alinea;e;"criação e extinção de Ministérios e órgãos da administração pública, observado o disposto no art. 84, VI;"
848;842;alinea;f;militares das Forças Armadas, seu regime jurídico, provimento de cargos, promoções, estabilidade, remuneração, reforma e transferência para a reserva.
849;839;paragrafo;§ 2º;A iniciativa popular pode ser exercida pela apresentação à Câmara dos Deputados de projeto de lei subscrito por, no mínimo, um por cento do eleitorado nacional, distribuído pelo menos por cinco Estados, com não menos de três décimos por cento dos eleitores de cada um deles.
850;838;artigo;Art. 62.;Em caso de relevância e urgência, o Presidente da República poderá adotar medidas provisórias, com força de lei, devendo submetê-las de imediato ao Congresso Nacional.
851;850;paragrafo;§ 1º;É vedada a edição de medidas provisórias sobre matéria:
852;851;inciso;I;relativa a:
853;852;alinea;a;"nacionalidade, cidadania, direitos políticos, partidos políticos e direito eleitoral;"
854;852;alinea;b;"direito penal, processual penal e processual civil;"
855;852;alinea;c;"organização do Poder Judiciário e do Ministério Público, a carreira e a garantia de seus membros;"
856;852;alinea;d;"planos plurianuais, diretrizes orçamentárias, orçamento e créditos adicionais e suplementares, ressalvado o previsto no art. 167, § 3º;"
857;851;inciso;II;"que vise a detenção ou seqüestro de bens, de poupança popular ou qualquer outro ativo financeiro;"
858;851;inciso;III;"reservada a lei complementar;"
859;851;inciso;IV;já disciplinada em projeto de lei aprovado pelo Congresso Nacional e pendente de sanção ou veto do Presidente da República.
860;850;paragrafo;§ 2º;Medida provisória que implique instituição ou majoração de impostos, exceto os previstos nos arts. 153, I, II, IV, V, e 154, II, só produzirá efeitos no exercício financeiro seguinte se houver sido convertida em lei até o último dia daquele em que foi editada.
861;850;paragrafo;§ 3º;As medidas provisórias, ressalvado o disposto nos §§ 11 e 12 perderão eficácia, desde a edição, se não forem convertidas em lei no prazo de sessenta dias, prorrogável, nos termos do § 7º, uma vez por igual período, devendo o Congresso Nacional disciplinar, por decreto legislativo, as relações jurídicas delas decorrentes.
862;850;paragrafo;§ 4º;O prazo a que se refere o § 3º contar-se-á da publicação da medida provisória, suspendendo-se durante os períodos de recesso do Congresso Nacional.
863;850;paragrafo;§ 5º;A deliberação de cada uma das Casas do Congresso Nacional sobre o mérito das medidas provisórias dependerá de juízo prévio sobre o atendimento de seus pressupostos constitucionais.
864;850;paragrafo;§ 6º;Se a medida provisória não for apreciada em até quarenta e cinco dias contados de sua publicação, entrará em regime de urgência, subseqüentemente, em cada uma das Casas do Congresso Nacional, ficando sobrestadas, até que se ultime a votação, todas as demais deliberações legislativas da Casa em que estiver tramitando.
865;850;paragrafo;§ 7º;Prorrogar-se-á uma única vez por igual período a vigência de medida provisória que, no prazo de sessenta dias, contado de sua publicação, não tiver a sua votação encerrada nas duas Casas do Congresso Nacional.
866;850;paragrafo;§ 8º;As medidas provisórias terão sua votação iniciada na Câmara dos Deputados.
867;850;paragrafo;§ 9º;Caberá à comissão mista de Deputados e Senadores examinar as medidas provisórias e sobre elas emitir parecer, antes de serem apreciadas, em sessão separada, pelo plenário de cada uma das Casas do Congresso Nacional.
868;850;paragrafo;§ 10.;É vedada a reedição, na mesma sessão legislativa, de medida provisória que tenha sido rejeitada ou que tenha perdido sua eficácia por decurso de prazo.
869;850;paragrafo;§ 11.;Não editado o decreto legislativo a que se refere o § 3º até sessenta dias após a rejeição ou perda de eficácia de medida provisória, as relações jurídicas constituídas e decorrentes de atos praticados durante sua vigência conservar-se-ão por ela regidas.
870;850;paragrafo;§ 12.;Aprovado projeto de lei de conversão alterando o texto original da medida provisória, esta manter-se-á integralmente em vigor até que seja sancionado ou vetado o projeto.
871;838;artigo;Art. 63.;Não será admitido aumento da despesa prevista:
872;871;inciso;I;"nos projetos de iniciativa exclusiva do Presidente da República, ressalvado o disposto no art. 166, §§ 3º e 4º;"
873;871;inciso;II;nos projetos sobre organização dos serviços administrativos da Câmara dos Deputados, do Senado Federal, dos tribunais federais e do Ministério Público.
874;838;artigo;Art. 64.;A discussão e votação dos projetos de lei de iniciativa do Presidente da República, do Supremo Tribunal Federal e dos Tribunais Superiores terão início na Câmara dos Deputados.
875;874;paragrafo;§ 1º;O Presidente da República poderá solicitar urgência para apreciação de projetos de sua iniciativa.
876;874;paragrafo;§ 2º;Se, no caso do § 1º, a Câmara dos Deputados e o Senado Federal não se manifestarem sobre a proposição, cada qual sucessivamente, em até quarenta e cinco dias, sobrestar-se-ão todas as demais deliberações legislativas da respectiva Casa, com exceção das que tenham prazo constitucional determinado, até que se ultime a votação.
877;874;paragrafo;§ 3º;A apreciação das emendas do Senado Federal pela Câmara dos Deputados far-se-á no prazo de dez dias, observado quanto ao mais o disposto no parágrafo anterior.
878;874;paragrafo;§ 4º;Os prazos do § 2º não correm nos períodos de recesso do Congresso Nacional, nem se aplicam aos projetos de código.
879;838;artigo;Art. 65.;O projeto de lei aprovado por uma Casa será revisto pela outra, em um só turno de discussão e votação, e enviado à sanção ou promulgação, se a Casa revisora o aprovar, ou arquivado, se o rejeitar.
880;879;paragrafo;Parágrafo único.;Sendo o projeto emendado, voltará à Casa iniciadora.
881;838;artigo;Art. 66.;A Casa na qual tenha sido concluída a votação enviará o projeto de lei ao Presidente da República, que, aquiescendo, o sancionará.
882;881;paragrafo;§ 1º;Se o Presidente da República considerar o projeto, no todo ou em parte, inconstitucional ou contrário ao interesse público, vetá-lo-á total ou parcialmente, no prazo de quinze dias úteis, contados da data do recebimento, e comunicará, dentro de quarenta e oito horas, ao Presidente do Senado Federal os motivos do veto.
883;881;paragrafo;§ 2º;O veto parcial somente abrangerá texto integral de artigo, de parágrafo, de inciso ou de alínea.
884;881;paragrafo;§ 3º;Decorrido o prazo de quinze dias, o silêncio do Presidente da República importará sanção.
885;881;paragrafo;§ 4º;O veto será apreciado em sessão conjunta, dentro de trinta dias a contar de seu recebimento, só podendo ser rejeitado pelo voto da maioria absoluta dos Deputados e Senadores.
886;881;paragrafo;§ 5º;Se o veto não for mantido, será o projeto enviado, para promulgação, ao Presidente da República.
887;881;paragrafo;§ 6º;Esgotado sem deliberação o prazo estabelecido no § 4º, o veto será colocado na ordem do dia da sessão imediata, sobrestadas as demais proposições, até sua votação final.
888;881;paragrafo;§ 7º;Se a lei não for promulgada dentro de quarenta e oito horas pelo Presidente da República, nos casos dos §§ 3º e 5º, o Presidente do Senado a promulgará, e, se este não o fizer em igual prazo, caberá ao Vice-Presidente do Senado fazê-lo.
889;838;artigo;Art. 67.;A matéria constante de projeto de lei rejeitado somente poderá constituir objeto de novo projeto, na mesma sessão legislativa, mediante proposta da maioria absoluta dos membros de qualquer das Casas do Congresso Nacional.
890;838;artigo;Art. 68.;As leis delegadas serão elaboradas pelo Presidente da República, que deverá solicitar a delegação ao Congresso Nacional.
891;890;paragrafo;§ 1º;Não serão objeto de delegação os atos de competência exclusiva do Congresso Nacional, os de competência privativa da Câmara dos Deputados ou do Senado Federal, a matéria reservada à lei complementar, nem a legislação sobre:
892;891;inciso;I;"organização do Poder Judiciário e do Ministério Público, a carreira e a garantia de seus membros;"
893;891;inciso;II;"nacionalidade, cidadania, direitos individuais, políticos e eleitorais;"
894;891;inciso;III;planos plurianuais, diretrizes orçamentárias e orçamentos.
895;890;paragrafo;§ 2º;A delegação ao Presidente da República terá a forma de resolução do Congresso Nacional, que especificará seu conteúdo e os termos de seu exercício.
896;890;paragrafo;§ 3º;Se a resolução determinar a apreciação do projeto pelo Congresso Nacional, este a fará em votação única, vedada qualquer emenda.
897;838;artigo;Art. 69.;As leis complementares serão aprovadas por maioria absoluta.
898;668;cabecalho;Seção IX;Da Fiscalização Contábil, Financeira e Orçamentária
899;898;artigo;Art. 70.;A fiscalização contábil, financeira, orçamentária, operacional e patrimonial da União e das entidades da administração direta e indireta, quanto à legalidade, legitimidade, economicidade, aplicação das subvenções e renúncia de receitas, será exercida pelo Congresso Nacional, mediante controle externo, e pelo sistema de controle interno de cada Poder.
900;899;paragrafo;Parágrafo único.;Prestará contas qualquer pessoa física ou jurídica, pública ou privada, que utilize, arrecade, guarde, gerencie ou administre dinheiros, bens e valores públicos ou pelos quais a União responda, ou que, em nome desta, assuma obrigações de natureza pecuniária.
901;898;artigo;Art. 71.;O controle externo, a cargo do Congresso Nacional, será exercido com o auxílio do Tribunal de Contas da União, ao qual compete:
902;901;inciso;I;"apreciar as contas prestadas anualmente pelo Presidente da República, mediante parecer prévio, que deverá ser elaborado em sessenta dias a contar de seu recebimento;"
903;901;inciso;II;"julgar as contas dos administradores e demais responsáveis por dinheiros, bens e valores públicos da administração direta e indireta, incluídas as fundações e sociedades instituídas e mantidas pelo poder público federal, e as contas daqueles que derem causa a perda, extravio ou outra irregularidade de que resulte prejuízo ao erário público;"
904;901;inciso;III;"apreciar, para fins de registro, a legalidade dos atos de admissão de pessoal, a qualquer título, na administração direta e indireta, incluídas as fundações instituídas e mantidas pelo poder público, excetuadas as nomeações para cargo de provimento em comissão, bem como a das concessões de aposentadorias, reformas e pensões, ressalvadas as melhorias posteriores que não alterem o fundamento legal do ato concessório;"
905;901;inciso;IV;"realizar, por iniciativa própria, da Câmara dos Deputados, do Senado Federal, de comissão técnica ou de inquérito, inspeções e auditorias de natureza contábil, financeira, orçamentária, operacional e patrimonial, nas unidades administrativas dos Poderes Legislativo, Executivo e Judiciário, e demais entidades referidas no inciso II;"
906;901;inciso;V;"fiscalizar as contas nacionais das empresas supranacionais de cujo capital social a União participe, de forma direta ou indireta, nos termos do tratado constitutivo;"
907;901;inciso;VI;"fiscalizar a aplicação de quaisquer recursos repassados pela União, mediante convênio, acordo, ajuste ou outros instrumentos congêneres, a Estado, ao Distrito Federal ou a Município;"
908;901;inciso;VII;"prestar as informações solicitadas pelo Congresso Nacional, por qualquer de suas Casas, ou por qualquer das respectivas comissões, sobre a fiscalização contábil, financeira, orçamentária, operacional e patrimonial e sobre resultados de auditorias e inspeções realizadas;"
909;901;inciso;VIII;"aplicar aos responsáveis, em caso de ilegalidade de despesa ou irregularidade de contas, as sanções previstas em lei, que estabelecerá, entre outras cominações, multa proporcional ao dano causado ao erário;"
910;901;inciso;IX;"assinar prazo para que o órgão ou entidade adote as providências necessárias ao exato cumprimento da lei, se verificada ilegalidade;"
911;901;inciso;X;"sustar, se não atendido, a execução do ato impugnado, comunicando a decisão à Câmara dos Deputados e ao Senado Federal;"
912;901;inciso;XI;representar ao Poder competente sobre irregularidades ou abusos apurados.
913;901;paragrafo;§ 1º;No caso de contrato, o ato de sustação será adotado diretamente pelo Congresso Nacional, que solicitará, de imediato, ao Poder Executivo as medidas cabíveis.
914;901;paragrafo;§ 2º;Se o Congresso Nacional ou o Poder Executivo, no prazo de noventa dias, não efetivar as medidas previstas no parágrafo anterior, o Tribunal decidirá a respeito.
915;901;paragrafo;§ 3º;As decisões do Tribunal de que resulte imputação de débito ou multa terão eficácia de título executivo.
916;901;paragrafo;§ 4º;O Tribunal encaminhará ao Congresso Nacional, trimestral e anualmente, relatório de suas atividades.
917;898;artigo;Art. 72.;A comissão mista permanente a que se refere o art. 166, § 1º, diante de indícios de despesas não autorizadas, ainda que sob a forma de investimentos não programados ou de subsídios não aprovados, poderá solicitar à autoridade governamental responsável que, no prazo de cinco dias, preste os esclarecimentos necessários.
918;917;paragrafo;§ 1º;Não prestados os esclarecimentos, ou considerados estes insuficientes, a comissão solicitará ao Tribunal pronunciamento conclusivo sobre a matéria, no prazo de trinta dias.
919;917;paragrafo;§ 2º;Entendendo o Tribunal irregular a despesa, a comissão, se julgar que o gasto possa causar dano irreparável ou grave lesão à economia pública, proporá ao Congresso Nacional sua sustação.
920;898;artigo;Art. 73.;O Tribunal de Contas da União, integrado por nove Ministros, tem sede no Distrito Federal, quadro próprio de pessoal e jurisdição em todo o território nacional, exercendo, no que couber, as atribuições previstas no art. 96.
921;920;paragrafo;§ 1º;Os Ministros do Tribunal de Contas da União serão nomeados dentre brasileiros que satisfaçam os seguintes requisitos:
922;921;inciso;I;"mais de trinta e cinco e menos de sessenta e cinco anos de idade;"
923;921;inciso;II;"idoneidade moral e reputação ilibada;"
924;921;inciso;III;"notórios conhecimentos jurídicos, contábeis, econômicos e financeiros ou de administração pública;"
925;921;inciso;IV;mais de dez anos de exercício de função ou de efetiva atividade profissional que exija os conhecimentos mencionados no inciso anterior.
926;920;paragrafo;§ 2º;Os Ministros do Tribunal de Contas da União serão escolhidos:
927;926;inciso;I;"um terço pelo Presidente da República, com aprovação do Senado Federal, sendo dois alternadamente dentre auditores e membros do Ministério Público junto ao Tribunal, indicados em lista tríplice pelo Tribunal, segundo os critérios de antiguidade e merecimento;"
928;926;inciso;II;dois terços pelo Congresso Nacional.
929;920;paragrafo;§ 3º;Os Ministros do Tribunal de Contas da União terão as mesmas garantias, prerrogativas, impedimentos, vencimentos e vantagens dos Ministros do Superior Tribunal de Justiça, aplicando-se-lhes, quanto à aposentadoria e pensão, as normas constantes do art. 40.
930;920;paragrafo;§ 4º;O auditor, quando em substituição a Ministro, terá as mesmas garantias e impedimentos do titular e, quando no exercício das demais atribuições da judicatura, as de juiz de Tribunal Regional Federal.
931;898;artigo;Art. 74.;Os Poderes Legislativo, Executivo e Judiciário manterão, de forma integrada, sistema de controle interno com a finalidade de:
932;931;inciso;I;"avaliar o cumprimento das metas previstas no plano plurianual, a execução dos programas de governo e dos orçamentos da União;"
933;931;inciso;II;"comprovar a legalidade e avaliar os resultados, quanto à eficácia e eficiência, da gestão orçamentária, financeira e patrimonial nos órgãos e entidades da administração federal, bem como da aplicação de recursos públicos por entidades de direito privado;"
934;931;inciso;III;"exercer o controle das operações de crédito, avais e garantias, bem como dos direitos e haveres da União;"
935;931;inciso;IV;apoiar o controle externo no exercício de sua missão institucional.
936;931;paragrafo;§ 1º;Os responsáveis pelo controle interno, ao tomarem conhecimento de qualquer irregularidade ou ilegalidade, dela darão ciência ao Tribunal de Contas da União, sob pena de responsabilidade solidária.
937;931;paragrafo;§ 2º;Qualquer cidadão, partido político, associação ou sindicato é parte legítima para, na forma da lei, denunciar irregularidades ou ilegalidades perante o Tribunal de Contas da União.
938;898;artigo;Art. 75.;As normas estabelecidas nesta Seção aplicam-se, no que couber, à organização, composição e fiscalização dos Tribunais de Contas dos Estados e do Distrito Federal, bem como dos Tribunais e Conselhos de Contas dos Municípios.
939;938;paragrafo;Parágrafo único.;As Constituições estaduais disporão sobre os Tribunais de Contas respectivos, que serão integrados por sete conselheiros.
940;667;cabecalho;Capítulo II;Do Poder Executivo
941;940;cabecalho;Seção I;Do Presidente e do Vice-Presidente da República
942;941;artigo;Art. 76.;O Poder Executivo é exercido pelo Presidente da República, auxiliado pelos Ministros de Estado.
943;941;artigo;Art. 77.;A eleição do Presidente e do Vice-Presidente da República realizar-se-á, simultaneamente, no primeiro domingo de outubro, em primeiro turno, e no último domingo de outubro, em segundo turno, se houver, do ano anterior ao do término do mandato presidencial vigente.
944;943;paragrafo;§ 1º;A eleição do Presidente da República importará a do Vice-Presidente com ele registrado.
945;943;paragrafo;§ 2º;Será considerado eleito Presidente o candidato que, registrado por partido político, obtiver a maioria absoluta de votos, não computados os em branco e os nulos.
946;943;paragrafo;§ 3º;Se nenhum candidato alcançar maioria absoluta na primeira votação, far-se-á nova eleição em até vinte dias após a proclamação do resultado, concorrendo os dois candidatos mais votados e considerando-se eleito aquele que obtiver a maioria dos votos válidos.
947;943;paragrafo;§ 4º;Se, antes de realizado o segundo turno, ocorrer morte, desistência ou impedimento legal de candidato, convocar-se-á, dentre os remanescentes, o de maior votação.
948;943;paragrafo;§ 5º;Se, na hipótese dos parágrafos anteriores, remanescer, em segundo lugar, mais de um candidato com a mesma votação, qualificar-se-á o mais idoso.
949;941;artigo;Art. 78.;O Presidente e o Vice-Presidente da República tomarão posse em sessão do Congresso Nacional, prestando o compromisso de manter, defender e cumprir a Constituição, observar as leis, promover o bem geral do povo brasileiro, sustentar a união, a integridade e a independência do Brasil.
950;949;paragrafo;Parágrafo único.;Se, decorridos dez dias da data fixada para a posse, o Presidente ou o Vice-Presidente, salvo motivo de força maior, não tiver assumido o cargo, este será declarado vago.
951;941;artigo;Art. 79.;Substituirá o Presidente, no caso de impedimento, e suceder-lhe-á, no de vaga, o Vice-Presidente.
952;951;paragrafo;Parágrafo único.;O Vice-Presidente da República, além de outras atribuições que lhe forem conferidas por lei complementar, auxiliará o Presidente, sempre que por ele convocado para missões especiais.
953;941;artigo;Art. 80.;Em caso de impedimento do Presidente e do Vice-Presidente, ou vacância dos respectivos cargos, serão sucessivamente chamados ao exercício da Presidência o Presidente da Câmara dos Deputados, o do Senado Federal e o do Supremo Tribunal Federal.
954;941;artigo;Art. 81.;Vagando os cargos de Presidente e Vice-Presidente da República, far-se-á eleição noventa dias depois de aberta a última vaga.
955;954;paragrafo;§ 1º;Ocorrendo a vacância nos últimos dois anos do período presidencial, a eleição para ambos os cargos será feita trinta dias depois da última vaga, pelo Congresso Nacional, na forma da lei.
956;954;paragrafo;§ 2º;Em qualquer dos casos, os eleitos deverão completar o período de seus antecessores.
957;941;artigo;Art. 82.;O mandato do Presidente da República é de quatro anos e terá início em primeiro de janeiro do ano seguinte ao da sua eleição.
958;941;artigo;Art. 83.;O Presidente e o Vice-Presidente da República não poderão, sem licença do Congresso Nacional, ausentar-se do País por período superior a quinze dias, sob pena de perda do cargo.
959;940;cabecalho;Seção II;Das Atribuições do Presidente da República
960;959;artigo;Art. 84.;Compete privativamente ao Presidente da República:
961;960;inciso;I;"nomear e exonerar os Ministros de Estado;"
962;960;inciso;II;"exercer, com o auxílio dos Ministros de Estado, a direção superior da administração federal;"
963;960;inciso;III;"iniciar o processo legislativo, na forma e nos casos previstos nesta Constituição;"
964;960;inciso;IV;"sancionar, promulgar e fazer publicar as leis, bem como expedir decretos e regulamentos para sua fiel execução;"
965;960;inciso;V;"vetar projetos de lei, total ou parcialmente;"
966;960;inciso;VI;dispor, mediante decreto, sobre:
967;966;alinea;a;"organização e funcionamento da administração federal, quando não implicar aumento de despesa nem criação ou extinção de órgãos públicos;"
968;966;alinea;b;"extinção de funções ou cargos públicos, quando vagos;"
969;960;inciso;VII;"manter relações com Estados estrangeiros e acreditar seus representantes diplomáticos;"
970;960;inciso;VIII;"celebrar tratados, convenções e atos internacionais, sujeitos a referendo do Congresso Nacional;"
971;960;inciso;IX;"decretar o estado de defesa e o estado de sítio;"
972;960;inciso;X;"decretar e executar a intervenção federal;"
973;960;inciso;XI;"remeter mensagem e plano de governo ao Congresso Nacional por ocasião da abertura da sessão legislativa, expondo a situação do País e solicitando as providências que julgar necessárias;"
974;960;inciso;XII;"conceder indulto e comutar penas, com audiência, se necessário, dos órgãos instituídos em lei;"
975;960;inciso;XIII;"exercer o comando supremo das Forças Armadas, nomear os Comandantes da Marinha, do Exército e da Aeronáutica, promover seus oficiais-generais e nomeá-los para os cargos que lhes são privativos;"
976;960;inciso;XIV;"nomear, após aprovação pelo Senado Federal, os Ministros do Supremo Tribunal Federal e dos Tribunais Superiores, os Governadores de Territórios, o Procurador-Geral da República, o presidente e os diretores do Banco Central e outros servidores, quando determinado em lei;"
977;960;inciso;XV;"nomear, observado o disposto no art. 73, os Ministros do Tribunal de Contas da União;"
978;960;inciso;XVI;"nomear os magistrados, nos casos previstos nesta Constituição, e o Advogado-Geral da União;"
979;960;inciso;XVII;"nomear membros do Conselho da República, nos termos do art. 89, VII;"
980;960;inciso;XVIII;"convocar e presidir o Conselho da República e o Conselho de Defesa Nacional;"
981;960;inciso;XIX;"declarar guerra, no caso de agressão estrangeira, autorizado pelo Congresso Nacional ou referendado por ele, quando ocorrida no intervalo das sessões legislativas, e, nas mesmas condições, decretar, total ou parcialmente, a mobilização nacional;"
982;960;inciso;XX;"celebrar a paz, autorizado ou com o referendo do Congresso Nacional;"
983;960;inciso;XXI;"conferir condecorações e distinções honoríficas;"
984;960;inciso;XXII;"permitir, nos casos previstos em lei complementar, que forças estrangeiras transitem pelo território nacional ou nele permaneçam temporariamente;"
985;960;inciso;XXIII;"enviar ao Congresso Nacional o plano plurianual, o projeto de lei de diretrizes orçamentárias e as propostas de orçamento previstas nesta Constituição;"
986;960;inciso;XXIV;"prestar, anualmente, ao Congresso Nacional, dentro de sessenta dias após a abertura da sessão legislativa, as contas referentes ao exercício anterior;"
987;960;inciso;XXV;"prover e extinguir os cargos públicos federais, na forma da lei;"
988;960;inciso;XXVI;"editar medidas provisórias com força de lei, nos termos do art. 62;"
989;960;inciso;XXVII;exercer outras atribuições previstas nesta Constituição.
990;960;paragrafo;Parágrafo único.;O Presidente da República poderá delegar as atribuições mencionadas nos incisos VI, XII e XXV, primeira parte, aos Ministros de Estado, ao Procurador-Geral da República ou ao Advogado-Geral da União, que observarão os limites traçados nas respectivas delegações.
991;940;cabecalho;Seção III;Da Responsabilidade do Presidente da República
992;991;artigo;Art. 85.;São crimes de responsabilidade os atos do Presidente da República que atentem contra a Constituição Federal e, especialmente, contra:
993;992;inciso;I;"a existência da União;"
994;992;inciso;II;"o livre exercício do Poder Legislativo, do Poder Judiciário, do Ministério Público e dos Poderes constitucionais das unidades da Federação;"
995;992;inciso;III;"o exercício dos direitos políticos, individuais e sociais;"
996;992;inciso;IV;"a segurança interna do País;"
