#;parent;type;ref;text
1;;livro;;Constituição da República Federativa do Brasil
2;1;texto;Preâmbulo;Nós, representantes do povo brasileiro, reunidos em Assembléia Nacional Constituinte para instituir um Estado Democrático, destinado a assegurar o exercício dos direitos sociais e individuais, a liberdade, a segurança, o bem-estar, o desenvolvimento, a igualdade e a justiça como valores supremos de uma sociedade fraterna, pluralista e sem preconceitos, fundada na harmonia social e comprometida, na ordem interna e internacional, com a solução pacífica das controvérsias, promulgamos, sob a proteção de Deus, a seguinte CONSTITUIÇÃO DA REPÚBLICA FEDERATIVA DO BRASIL.
3;1;cabecalho;Título I;Dos Princípios Fundamentais
4;3;artigo;Art. 1º;A República Federativa do Brasil, formada pela união indissolúvel dos Estados e Municípios e do Distrito Federal, constitui-se em Estado democrático de direito e tem como fundamentos:
5;4;inciso;I;"a soberania;"
6;4;inciso;II;"a cidadania;"
7;4;inciso;III;"a dignidade da pessoa humana;"
8;4;inciso;IV;"os valores sociais do trabalho e da livre iniciativa;"
9;4;inciso;V;o pluralismo político.
10;4;paragrafo;Parágrafo único.;Todo o poder emana do povo, que o exerce por meio de representantes eleitos ou diretamente, nos termos desta Constituição.
11;3;artigo;Art. 2º;São Poderes da União, independentes e harmônicos entre si, o Legislativo, o Executivo e o Judiciário.
12;3;artigo;Art. 3º;Constituem objetivos fundamentais da República Federativa do Brasil:
13;12;inciso;I;"construir uma sociedade livre, justa e solidária;"
14;12;inciso;II;"garantir o desenvolvimento nacional;"
15;12;inciso;III;"erradicar a pobreza e a marginalização e reduzir as desigualdades sociais e regionais;"
16;12;inciso;IV;promover o bem de todos, sem preconceitos de origem, raça, sexo, cor, idade e quaisquer outras formas de discriminação.
17;3;artigo;Art. 4º;A República Federativa do Brasil rege-se nas suas relações internacionais pelos seguintes princípios:
18;17;inciso;I;"independência nacional;"
19;17;inciso;II;"prevalência dos direitos humanos;"
20;17;inciso;III;"autodeterminação dos povos;"
21;17;inciso;IV;"não-intervenção;"
22;17;inciso;V;"igualdade entre os Estados;"
23;17;inciso;VI;"defesa da paz;"
24;17;inciso;VII;"solução pacífica dos conflitos;"
25;17;inciso;VIII;"repúdio ao terrorismo e ao racismo;"
26;17;inciso;IX;"cooperação entre os povos para o progresso da humanidade;"
27;17;inciso;X;concessão de asilo político.
28;17;paragrafo;Parágrafo único.;A República Federativa do Brasil buscará a integração econômica, política, social e cultural dos povos da América Latina, visando à formação de uma comunidade latino-americana de nações.
29;1;cabecalho;Título II;Dos Direitos e Garantias Fundamentais
30;29;cabecalho;Capítulo I;Dos Direitos e Deveres Individuais e Coletivos
31;30;artigo;Art. 5º;Todos são iguais perante a lei, sem distinção de qualquer natureza, garantindo-se aos brasileiros e aos estrangeiros residentes no País a inviolabilidade do direito à vida, à liberdade, à igualdade, à segurança e à propriedade, nos termos seguintes:
32;31;inciso;I;"homens e mulheres são iguais em direitos e obrigações, nos termos desta Constituição;"
33;31;inciso;II;"ninguém será obrigado a fazer ou deixar de fazer alguma coisa senão em virtude de lei;"
34;31;inciso;III;"ninguém será submetido a tortura nem a tratamento desumano ou degradante;"
35;31;inciso;IV;"é livre a manifestação do pensamento, sendo vedado o anonimato;"
36;31;inciso;V;"é assegurado o direito de resposta, proporcional ao agravo, além da indenização por dano material, moral ou à imagem;"
37;31;inciso;VI;"é inviolável a liberdade de consciência e de crença, sendo assegurado o livre exercício dos cultos religiosos e garantida, na forma da lei, a proteção aos locais de culto e a suas liturgias;"
38;31;inciso;VII;"é assegurada, nos termos da lei, a prestação de assistência religiosa nas entidades civis e militares de internação coletiva;"
39;31;inciso;VIII;"ninguém será privado de direitos por motivo de crença religiosa ou de convicção filosófica ou política, salvo se as invocar para eximir-se de obrigação legal a todos imposta e recusar-se a cumprir prestação alternativa, fixada em lei;"
40;31;inciso;IX;"é livre a expressão da atividade intelectual, artística, científica e de comunicação, independentemente de censura ou licença;"
41;31;inciso;X;"são invioláveis a intimidade, a vida privada, a honra e a imagem das pessoas, assegurado o direito a indenização pelo dano material ou moral decorrente de sua violação;"
42;31;inciso;XI;"a casa é asilo inviolável do indivíduo, ninguém nela podendo penetrar sem consentimento do morador, salvo em caso de flagrante delito ou desastre, ou para prestar socorro, ou, durante o dia, por determinação judicial;"
43;31;inciso;XII;"é inviolável o sigilo da correspondência e das comunicações telegráficas, de dados e das comunicações telefônicas, salvo, no último caso, por ordem judicial, nas hipóteses e na forma que a lei estabelecer para fins de investigação criminal ou instrução processual penal;"
44;31;inciso;XIII;"é livre o exercício de qualquer trabalho, ofício ou profissão, atendidas as qualificações profissionais que a lei estabelecer;"
45;31;inciso;XIV;"é assegurado a todos o acesso à informação e resguardado o sigilo da fonte, quando necessário ao exercício profissional;"
46;31;inciso;XV;"é livre a locomoção no território nacional em tempo de paz, podendo qualquer pessoa, nos termos da lei, nele entrar, permanecer ou dele sair com seus bens;"
47;31;inciso;XVI;"todos podem reunir-se pacificamente, sem armas, em locais abertos ao público, independentemente de autorização, desde que não frustrem outra reunião anteriormente convocada para o mesmo local, sendo apenas exigido prévio aviso à autoridade competente;"
48;31;inciso;XVII;"é plena a liberdade de associação para fins lícitos, vedada a de caráter paramilitar;"
49;31;inciso;XVIII;"a criação de associações e, na forma da lei, a de cooperativas independem de autorização, sendo vedada a interferência estatal em seu funcionamento;"
50;31;inciso;XIX;"as associações só poderão ser compulsoriamente dissolvidas ou ter suas atividades suspensas por decisão judicial, exigindo-se, no primeiro caso, o trânsito em julgado;"
51;31;inciso;XX;"ninguém poderá ser compelido a associar-se ou a permanecer associado;"
52;31;inciso;XXI;"as entidades associativas, quando expressamente autorizadas, têm legitimidade para representar seus filiados judicial ou extrajudicialmente;"
53;31;inciso;XXII;"é garantido o direito de propriedade;"
54;31;inciso;XXIII;"a propriedade atenderá a sua função social;"
55;31;inciso;XXIV;"a lei estabelecerá o procedimento para desapropriação por necessidade ou utilidade pública, ou por interesse social, mediante justa e prévia indenização em dinheiro, ressalvados os casos previstos nesta Constituição;"
56;31;inciso;XXV;"no caso de iminente perigo público, a autoridade competente poderá usar de propriedade particular, assegurada ao proprietário indenização ulterior, se houver dano;"
57;31;inciso;XXVI;"a pequena propriedade rural, assim definida em lei, desde que trabalhada pela família, não será objeto de penhora para pagamento de débitos decorrentes de sua atividade produtiva, dispondo a lei sobre os meios de financiar o seu desenvolvimento;"
58;31;inciso;XXVII;"aos autores pertence o direito exclusivo de utilização, publicação ou reprodução de suas obras, transmissível aos herdeiros pelo tempo que a lei fixar;"
59;31;inciso;XXVIII;são assegurados, nos termos da lei:
60;59;alinea;a;"a proteção às participações individuais em obras coletivas e à reprodução da imagem e voz humanas, inclusive nas atividades desportivas;"
61;59;alinea;b;"o direito de fiscalização do aproveitamento econômico das obras que criarem ou de que participarem aos criadores, aos intérpretes e às respectivas representações sindicais e associativas;"
62;31;inciso;XXIX;"a lei assegurará aos autores de inventos industriais privilégio temporário para sua utilização, bem como proteção às criações industriais, à propriedade das marcas, aos nomes de empresas e a outros signos distintivos, tendo em vista o interesse social e o desenvolvimento tecnológico e econômico do País;"
63;31;inciso;XXX;"é garantido o direito de herança;"
64;31;inciso;XXXI;"a sucessão de bens de estrangeiros situados no País será regulada pela lei brasileira em benefício do cônjuge ou dos filhos brasileiros, sempre que não lhes seja mais favorável a lei pessoal do de cujus;"
65;31;inciso;XXXII;"o Estado promoverá, na forma da lei, a defesa do consumidor;"
66;31;inciso;XXXIII;"todos têm direito a receber dos órgãos públicos informações de seu interesse particular, ou de interesse coletivo ou geral, que serão prestadas no prazo da lei, sob pena de responsabilidade, ressalvadas aquelas cujo sigilo seja imprescindível à segurança da sociedade e do Estado;"
67;31;inciso;XXXIV;são a todos assegurados, independentemente do pagamento de taxas:
68;67;alinea;a;"o direito de petição aos poderes públicos em defesa de direitos ou contra ilegalidade ou abuso de poder;"
69;67;alinea;b;"a obtenção de certidões em repartições públicas, para defesa de direitos e esclarecimento de situações de interesse pessoal;"
70;31;inciso;XXXV;"a lei não excluirá da apreciação do Poder Judiciário lesão ou ameaça a direito;"
71;31;inciso;XXXVI;"a lei não prejudicará o direito adquirido, o ato jurídico perfeito e a coisa julgada;"
72;31;inciso;XXXVII;"não haverá juízo ou tribunal de exceção;"
73;31;inciso;XXXVIII;é reconhecida a instituição do júri, com a organização que lhe der a lei, assegurados:
74;73;alinea;a;"a plenitude de defesa;"
75;73;alinea;b;"o sigilo das votações;"
76;73;alinea;c;"a soberania dos veredictos;"
77;73;alinea;d;"a competência para o julgamento dos crimes dolosos contra a vida;"
78;31;inciso;XXXIX;"não há crime sem lei anterior que o defina, nem pena sem prévia cominação legal;"
79;31;inciso;XL;"a lei penal não retroagirá, salvo para beneficiar o réu;"
80;31;inciso;XLI;"a lei punirá qualquer discriminação atentatória dos direitos e liberdades fundamentais;"
81;31;inciso;XLII;"a prática do racismo constitui crime inafiançável e imprescritível, sujeito à pena de reclusão, nos termos da lei;"
82;31;inciso;XLIII;"a lei considerará crimes inafiançáveis e insuscetíveis de graça ou anistia a prática da tortura, o tráfico ilícito de entorpecentes e drogas afins, o terrorismo e os definidos como crimes hediondos, por eles respondendo os mandantes, os executores e os que, podendo evitá-los, se omitirem;"
83;31;inciso;XLIV;"constitui crime inafiançável e imprescritível a ação de grupos armados, civis ou militares, contra a ordem constitucional e o Estado democrático;"
84;31;inciso;XLV;"nenhuma pena passará da pessoa do condenado, podendo a obrigação de reparar o dano e a decretação do perdimento de bens ser, nos termos da lei, estendidas aos sucessores e contra eles executadas, até o limite do valor do patrimônio transferido;"
85;31;inciso;XLVI;a lei regulará a individualização da pena e adotará, entre outras, as seguintes:
86;85;alinea;a;"privação ou restrição da liberdade;"
87;85;alinea;b;"perda de bens;"
88;85;alinea;c;"multa;"
89;85;alinea;d;"prestação social alternativa;"
90;85;alinea;e;"suspensão ou interdição de direitos;"
91;31;inciso;XLVII;não haverá penas:
92;91;alinea;a;"de morte, salvo em caso de guerra declarada, nos termos do art. 84, XIX;"
93;91;alinea;b;"de caráter perpétuo;"
94;91;alinea;c;"de trabalhos forçados;"
95;91;alinea;d;"de banimento;"
96;91;alinea;e;"cruéis;"
97;31;inciso;XLVIII;"a pena será cumprida em estabelecimentos distintos, de acordo com a natureza do delito, a idade e o sexo do apenado;"
98;31;inciso;XLIX;"é assegurado aos presos o respeito à integridade física e moral;"
99;31;inciso;L;"às presidiárias serão asseguradas condições para que possam permanecer com seus filhos durante o período de amamentação;"
100;31;inciso;LI;"nenhum brasileiro será extraditado, salvo o naturalizado, em caso de crime comum, praticado antes da naturalização, ou de comprovado envolvimento em tráfico ilícito de entorpecentes e drogas afins, na forma da lei;"
101;31;inciso;LII;"não será concedida extradição de estrangeiro por crime político ou de opinião;"
102;31;inciso;LIII;"ninguém será processado nem sentenciado senão pela autoridade competente;"
103;31;inciso;LIV;"ninguém será privado da liberdade ou de seus bens sem o devido processo legal;"
104;31;inciso;LV;"aos litigantes, em processo judicial ou administrativo, e aos acusados em geral são assegurados o contraditório e a ampla defesa, com os meios e recursos a ela inerentes;"
105;31;inciso;LVI;"são inadmissíveis, no processo, as provas obtidas por meios ilícitos;"
106;31;inciso;LVII;"ninguém será considerado culpado até o trânsito em julgado de sentença penal condenatória;"
107;31;inciso;LVIII;"o civilmente identificado não será submetido a identificação criminal, salvo nas hipóteses previstas em lei;"
108;31;inciso;LIX;"será admitida ação privada nos crimes de ação pública, se esta não for intentada no prazo legal;"
109;31;inciso;LX;"a lei só poderá restringir a publicidade dos atos processuais quando a defesa da intimidade ou o interesse social o exigirem;"
110;31;inciso;LXI;"ninguém será preso senão em flagrante delito ou por ordem escrita e fundamentada de autoridade judiciária competente, salvo nos casos de transgressão militar ou crime propriamente militar, definidos em lei;"
111;31;inciso;LXII;"a prisão de qualquer pessoa e o local onde se encontre serão comunicados imediatamente ao juiz competente e à família do preso ou à pessoa por ele indicada;"
112;31;inciso;LXIII;"o preso será informado de seus direitos, entre os quais o de permanecer calado, sendo-lhe assegurada a assistência da família e de advogado;"
113;31;inciso;LXIV;"o preso tem direito à identificação dos responsáveis por sua prisão ou por seu interrogatório policial;"
114;31;inciso;LXV;"a prisão ilegal será imediatamente relaxada pela autoridade judiciária;"
115;31;inciso;LXVI;"ninguém será levado à prisão ou nela mantido quando a lei admitir a liberdade provisória, com ou sem fiança;"
116;31;inciso;LXVII;"não haverá prisão civil por dívida, salvo a do responsável pelo inadimplemento voluntário e inescusável de obrigação alimentícia e a do depositário infiel;"
117;31;inciso;LXVIII;"conceder-se-á habeas corpus sempre que alguém sofrer ou se achar ameaçado de sofrer violência ou coação em sua liberdade de locomoção, por ilegalidade ou abuso de poder;"
118;31;inciso;LXIX;"conceder-se-á mandado de segurança para proteger direito líquido e certo, não amparado por habeas corpus ou habeas data, quando o responsável pela ilegalidade ou abuso de poder for autoridade pública ou agente de pessoa jurídica no exercício de atribuições do poder público;"
119;31;inciso;LXX;o mandado de segurança coletivo pode ser impetrado por:
120;119;alinea;a;"partido político com representação no Congresso Nacional;"
121;119;alinea;b;"organização sindical, entidade de classe ou associação legalmente constituída e em funcionamento há pelo menos um ano, em defesa dos interesses de seus membros ou associados;"
122;31;inciso;LXXI;"conceder-se-á mandado de injunção sempre que a falta de norma regulamentadora torne inviável o exercício dos direitos e liberdades constitucionais e das prerrogativas inerentes à nacionalidade, à soberania e à cidadania;"
123;31;inciso;LXXII;conceder-se-á habeas data:
124;123;alinea;a;"para assegurar o conhecimento de informações relativas à pessoa do impetrante, constantes de registros ou bancos de dados de entidades governamentais ou de caráter público;"
125;123;alinea;b;"para a retificação de dados, quando não se prefira fazê-lo por processo sigiloso, judicial ou administrativo;"
126;31;inciso;LXXIII;"qualquer cidadão é parte legítima para propor ação popular que vise a anular ato lesivo ao patrimônio público ou de entidade de que o Estado participe, à moralidade administrativa, ao meio ambiente e ao patrimônio histórico e cultural, ficando o autor, salvo comprovada má-fé, isento de custas judiciais e do ônus da sucumbência;"
127;31;inciso;LXXIV;"o Estado prestará assistência jurídica integral e gratuita aos que comprovarem insuficiência de recursos;"
128;31;inciso;LXXV;"o Estado indenizará o condenado por erro judiciário, assim como o que ficar preso além do tempo fixado na sentença;"
129;31;inciso;LXXVI;são gratuitos para os reconhecidamente pobres, na forma da lei:
130;129;alinea;a;"o registro civil de nascimento;"
131;129;alinea;b;"a certidão de óbito;"
132;31;inciso;LXXVII;são gratuitas as ações de habeas corpus e habeas data, e, na forma da lei, os atos necessários ao exercício da cidadania.
133;31;inciso;LXXVIII;a todos, no âmbito judicial e administrativo, são assegurados a razoável duração do processo e os meios que garantam a celeridade de sua tramitação.
134;31;paragrafo;§ 1º;As normas definidoras dos direitos e garantias fundamentais têm aplicação imediata.
135;31;paragrafo;§ 2º;Os direitos e garantias expressos nesta Constituição não excluem outros decorrentes do regime e dos princípios por ela adotados, ou dos tratados internacionais em que a República Federativa do Brasil seja parte.
136;31;paragrafo;§ 3º;Os tratados e convenções internacionais sobre direitos humanos que forem aprovados, em cada Casa do Congresso Nacional, em dois turnos, por três quintos dos votos dos respectivos membros, serão equivalentes às emendas constitucionais.
137;31;paragrafo;§ 4º;O Brasil se submete à jurisdição de Tribunal Penal Internacional a cuja criação tenha manifestado adesão.
138;29;cabecalho;Capítulo II;Dos Direitos Sociais
139;138;artigo;Art. 6º;São direitos sociais a educação, a saúde, a alimentação, o trabalho, a moradia, o transporte, o lazer, a segurança, a previdência social, a proteção à maternidade e à infância, a assistência aos desamparados, na forma desta Constituição.
140;138;artigo;Art. 7º;São direitos dos trabalhadores urbanos e rurais, além de outros que visem à melhoria de sua condição social:
141;140;inciso;I;"relação de emprego protegida contra despedida arbitrária ou sem justa causa, nos termos de lei complementar, que preverá indenização compensatória, dentre outros direitos;"
142;140;inciso;II;"seguro-desemprego, em caso de desemprego involuntário;"
143;140;inciso;III;"fundo de garantia do tempo de serviço;"
144;140;inciso;IV;"salário mínimo, fixado em lei, nacionalmente unificado, capaz de atender às suas necessidades vitais básicas e às de sua família com moradia, alimentação, educação, saúde, lazer, vestuário, higiene, transporte e previdência social, com reajustes periódicos que lhe preservem o poder aquisitivo, sendo vedada sua vinculação para qualquer fim;"
145;140;inciso;V;"piso salarial proporcional à extensão e à complexidade do trabalho;"
146;140;inciso;VI;"irredutibilidade do salário, salvo o disposto em convenção ou acordo coletivo;"
147;140;inciso;VII;"garantia de salário, nunca inferior ao mínimo, para os que percebem remuneração variável;"
148;140;inciso;VIII;"décimo terceiro salário com base na remuneração integral ou no valor da aposentadoria;"
149;140;inciso;IX;"remuneração do trabalho noturno superior à do diurno;"
150;140;inciso;X;"proteção do salário na forma da lei, constituindo crime sua retenção dolosa;"
151;140;inciso;XI;"participação nos lucros, ou resultados, desvinculada da remuneração, e, excepcionalmente, participação na gestão da empresa, conforme definido em lei;"
152;140;inciso;XII;"salário-família pago em razão do dependente do trabalhador de baixa renda nos termos da lei;"
153;140;inciso;XIII;"duração do trabalho normal não superior a oito horas diárias e quarenta e quatro semanais, facultada a compensação de horários e a redução da jornada, mediante acordo ou convenção coletiva de trabalho;"
154;140;inciso;XIV;"jornada de seis horas para o trabalho realizado em turnos ininterruptos de revezamento, salvo negociação coletiva;"
155;140;inciso;XV;"repouso semanal remunerado, preferencialmente aos domingos;"
156;140;inciso;XVI;"remuneração do serviço extraordinário superior, no mínimo, em cinqüenta por cento à do normal;"
157;140;inciso;XVII;"gozo de férias anuais remuneradas com, pelo menos, um terço a mais do que o salário normal;"
158;140;inciso;XVIII;"licença à gestante, sem prejuízo do emprego e do salário, com a duração de cento e vinte dias;"
159;140;inciso;XIX;"licença-paternidade, nos termos fixados em lei;"
160;140;inciso;XX;"proteção do mercado de trabalho da mulher, mediante incentivos específicos, nos termos da lei;"
161;140;inciso;XXI;"aviso prévio proporcional ao tempo de serviço, sendo no mínimo de trinta dias, nos termos da lei;"
162;140;inciso;XXII;"redução dos riscos inerentes ao trabalho, por meio de normas de saúde, higiene e segurança;"
163;140;inciso;XXIII;"adicional de remuneração para as atividades penosas, insalubres ou perigosas, na forma da lei;"
164;140;inciso;XXIV;"aposentadoria;"
165;140;inciso;XXV;"assistência gratuita aos filhos e dependentes desde o nascimento até 5 (cinco) anos de idade em creches e pré-escolas;"
166;140;inciso;XXVI;"reconhecimento das convenções e acordos coletivos de trabalho;"
167;140;inciso;XXVII;"proteção em face da automação, na forma da lei;"
168;140;inciso;XXVIII;"seguro contra acidentes de trabalho, a cargo do empregador, sem excluir a indenização a que este está obrigado, quando incorrer em dolo ou culpa;"
169;140;inciso;XXIX;"ação, quanto aos créditos resultantes das relações de trabalho, com prazo prescricional de cinco anos para os trabalhadores urbanos e rurais, até o limite de dois anos após a extinção do contrato de trabalho;"
170;169;alinea;a;(Revogada).
171;169;alinea;b;(Revogada).
172;140;inciso;XXX;"proibição de diferença de salários, de exercício de funções e de critério de admissão por motivo de sexo, idade, cor ou estado civil;"
173;140;inciso;XXXI;"proibição de qualquer discriminação no tocante a salário e critérios de admissão do trabalhador portador de deficiência;"
174;140;inciso;XXXII;"proibição de distinção entre trabalho manual, técnico e intelectual ou entre os profissionais respectivos;"
175;140;inciso;XXXIII;"proibição de trabalho noturno, perigoso ou insalubre a menores de dezoito e de qualquer trabalho a menores de dezesseis anos, salvo na condição de aprendiz, a partir de quatorze anos;"
176;140;inciso;XXXIV;igualdade de direitos entre o trabalhador com vínculo empregatício permanente e o trabalhador avulso.
177;140;paragrafo;Parágrafo único.;São assegurados à categoria dos trabalhadores domésticos os direitos previstos nos incisos IV, VI, VII, VIII, X, XIII, XV, XVI, XVII, XVIII, XIX, XXI, XXII, XXIV, XXVI, XXX, XXXI e XXXIII e, atendidas as condições estabelecidas em lei e observada a simplificação do cumprimento das obrigações tributárias, principais e acessórias, decorrentes da relação de trabalho e suas peculiaridades, os previstos nos incisos I, II, III, IX, XII, XXV e XXVIII, bem como a sua integração à previdência social.
178;138;artigo;Art. 8º;É livre a associação profissional ou sindical, observado o seguinte:
179;178;inciso;I;"a lei não poderá exigir autorização do Estado para a fundação de sindicato, ressalvado o registro no órgão competente, vedadas ao poder público a interferência e a intervenção na organização sindical;"
180;178;inciso;II;"é vedada a criação de mais de uma organização sindical, em qualquer grau, representativa de categoria profissional ou econômica, na mesma base territorial, que será definida pelos trabalhadores ou empregadores interessados, não podendo ser inferior à área de um Município;"
181;178;inciso;III;"ao sindicato cabe a defesa dos direitos e interesses coletivos ou individuais da categoria, inclusive em questões judiciais ou administrativas;"
182;178;inciso;IV;"a assembléia geral fixará a contribuição que, em se tratando de categoria profissional, será descontada em folha, para custeio do sistema confederativo da representação sindical respectiva, independentemente da contribuição prevista em lei;"
183;178;inciso;V;"ninguém será obrigado a filiar-se ou a manter-se filiado a sindicato;"
184;178;inciso;VI;"é obrigatória a participação dos sindicatos nas negociações coletivas de trabalho;"
185;178;inciso;VII;"o aposentado filiado tem direito a votar e ser votado nas organizações sindicais;"
186;178;inciso;VIII;é vedada a dispensa do empregado sindicalizado a partir do registro da candidatura a cargo de direção ou representação sindical e, se eleito, ainda que suplente, até um ano após o final do mandato, salvo se cometer falta grave nos termos da lei.
187;178;paragrafo;Parágrafo único.;As disposições deste artigo aplicam-se à organização de sindicatos rurais e de colônias de pescadores, atendidas as condições que a lei estabelecer.
